<!ELEMENT pagina (cabecera, cuerpo, pie)>
	<!ELEMENT  cabecera (titulo, texto1)>
			<!ELEMENT titulo (#PCDATA)>
			<!ELEMENT texto1 (#PCDATA)>		
	<!ELEMENT  cuerpo (calle, cp, localidad?, provincia, telefono*, fila*)>
			<!ELEMENT calle (#PCDATA)>
			<!ELEMENT cp (#PCDATA)>
			<!ELEMENT localidad (#PCDATA)>
			<!ELEMENT provincia (#PCDATA)>
			<!ELEMENT telefono (#PCDATA)>
			<!ELEMENT fila (txt*)>
				<!ELEMENT txt (#PCDATA)>
<!ELEMENT pie (link?, mail)>
		<!ELEMENT link (ruta, texto)>
			<!ELEMENT ruta (#PCDATA)>
			<!ELEMENT texto (#PCDATA)>
		<!ELEMENT mail (correo, asunto)>
			<!ELEMENT correo (#PCDATA)>
			<!ELEMENT asunto (#PCDATA)>
		

